{
  "schemaVersion": "pedantic.effect-observation.v1",
  "eventId": "event-1",
  "commandId": "command-1",
  "operationId": "operation-1",
  "stepId": "step-1",
  "attemptId": "attempt-1",
  "targetId": "target-1",
  "agentId": "agent-1",
  "sequence": 1,
  "status": "completed",
  "causationId": "cause-1",
  "correlationId": "correlation-1",
  "redactionClass": "metadata-only",
  "diagnostics": [{ "code": "OUTPUT_REDACTED" }],
  "outputDigest": "sha256:aaaaaaaaaaaaaaaaaaaaaaaaaaaaaaaaaaaaaaaaaaaaaaaaaaaaaaaaaaaaaaaa"
}
